Nivea Visage Refreshing Cleansing Gel,1 water glycerin acid laureth citric betaine lactic hydroxyethylcellulose coco nivea cellulose peg-6 visage decylaldehyde acqua acylates acetates
L'Oreal Paris Men Expert Pure Clay Detox Mask,1 kaolin
La Roche~Posay Toleriane Purifying Foaming Gel,1 sodium water glycerin disodium sulfate chloride laureth benzoate betaine cocamidopropyl lauryl cocoyl methylisothiazolinone methylchloroisothiazolinone glutamate cocoamphodiacetate
Nivea Visage Q10 Plus Anti Wrinkle Miracle Cream,1 sodium alcohol water glycerin glycol dimethicone phenoxyethanol stearate cetearyl butter acetate polysorbate tocopheryl seed hydroxide shea fruit cyclopentasiloxane carbomer sorbitan hyaluronate butyrospermum park polyacrylate palmitoyl peg-8 pentylene tetrapeptide polyisobutene theobroma cacao arachidyl
Neutrogena Oil Free Acne Wash,1 extract seed vitamin turmeric grape
Nivea Visage Q10 Plus Firming Day Cream,1 sodium extract alcohol water glycerin glycol acid dimethicone edta disodium aloe leaf sulfate propylene chloride acetate potassium butylene tocopheryl seed benzoate palmitate citric panthenol ethylhexyl aqua barbadensis sorbate cyclopentasiloxane titanium dioxide hydrolyzed protein allantoin alkyl citrate oxide linalool caprylic capric hexyl retinyl kernel salicylate triglyceride zinc limonene isohexadecane butyl methoxydibenzoylmethane grape benzophenone lecithin squalane citronellol rice alpha hydroxybenzoyl diethylamino octocrylene dimethiconol vitis vinifera ethylhexyloxyphenol methoxyphenyl triazine argania geraniol spinosa oxybenzone polyacrylamide perfume copper methoxycrylene glucan pantolactone phenethyl oligosaccharide
Nivea Visage Q10 Plus Firming Night Cream,1 sodium alcohol water glycerin dimethicone fragrance phenoxyethanol stearate methylparaben glyceryl acetate polysorbate cetyl tocopheryl propylparaben palmitate aqua benzyl butylparaben ascorbyl stearyl citrate phosphate urea caprylic capric retinyl denat triglyceride acetyl hexapeptide imidazolidinyl
L'Oreal Paris Men Expert Pure Clay Detox Mask,1 alcohol water glycerin acid dimethicone fragrance edta disodium cetearyl chloride kaolin sorbitan oleate quaternium cetrimonium ceteth montmorillonite benzoic
Nivea Visage Q10 Plus Firming Facial Toner,1 alcohol water glycerin glycol fragrance edta disodium phenoxyethanol methylparaben propylene benzoate benzyl butylparaben product denat ingredients iodopropynyl butylcarbamate nivea facial beauty toner plus visage phythoxyethanol
Vicco sari turmeric cream,1 butter seed coconut shea beeswax vitamin peel orange rose sunflower mango flour tamanu gram
Vicco turmeric cream for face,1 coconut almond jojoba turmeric cream face vicco
Vicco amla and turmeric cream,1 sodium alcohol water glycerin glycol acid fragrance edta disodium stearate aloe cetearyl methylparaben leaf glyceryl butter propylparaben hydroxide shea aqua barbadensis peg-100 xanthan carbomer stearic juice allantoin hydrogenated butyrospermum park distearate glucoside turmeric cream vegetable amla trideceth vicco succinic
Vicco turmeric and amla cream,1 extract leaf turmeric cream contains amla vicco betel
Vicco turmeric cream for skin,1 sodium fragrance phenoxyethanol hydroxide beeswax petrolatum aluminum product turmeric cream skin menthol mentha starch yellow beauty octenylsuccinate white with synthetic vicco arvensis
Vicco morinda cream,1 sodium extract alcohol water glycerin glycol dimethicone fragrance edta disodium phenoxyethanol stearate cetearyl methylparaben leaf glyceryl chloride polysorbate butylene ethylhexyl betaine xanthan hydrolyzed silica sorbitol beeswax ethylparaben methoxycinnamate ceteareth glucoside salicylate behentrimonium butyl methoxydibenzoylmethane propanediol squalane camellia sinensis chlorphenesin green cyclomethicone copolyol sucrose hexanediol rapeseed trideceth brassica silk propolis campestris fructooligosaccharides sterols
Vicco amla cream,1 sodium water glycerin acid disodium phenoxyethanol glyceryl chloride laureth potassium benzoate citric betaine cocamidopropyl sorbate methylisothiazolinone methylchloroisothiazolinone lauroyl caprylic capric glucoside oleate dicaprylyl hydroxyethylcellulose triglyceride carbonate coco cocoate sarcosinate peg-7 amla decyl distearyldimonium sulphosuccinate arabic turpentine boric
Vicco morinda amla and turmeric cream,1 alcohol aloe cetearyl butter panthenol coconut shea vera jojoba beeswax vitamin castor kernel apricot borax
Biotique Bio Aloe Vera Gel,1 extract glycerin glycol edta aloe leaf propylene acetate tocopheryl crosspolymer vera aqua barbadensis fruit acrylates acrylate alkyl tetrasodium biotique papaya carica
Biotique Bio Herb N Spice,1 honey carrot yogurt banana nuts
Biotique Bio Olive Squeeze,1 coconut olive biotique contains squeeze
Biotique Bio Fresh Cream,1 sodium extract alcohol water glycerin glycol edta phenoxyethanol stearate aloe cetearyl leaf glyceryl acetate butylene tocopheryl seed benzoate panthenol hydroxide barbadensis sorbitol tetrasodium officinalis dulcis glucoside root prunus chinensis simmondsia bran helianthus annuus acacia sativa calendula amygdalus carthamus tinctorius melissa oryza chondrus crispus althaea
Biotique Bio Aloe Vera Gel,1 water aloe vera biotique contains
Biotique Bio Coconut Whitening & Brightening Cream,1 water aloe butter coconut shea vera barbadensis beeswax sunflower cream ingredients biotique mango safflower refined
Neutrogena Ultra Sheer Face And Body Sunscreen SPF 50,1 water ethylhexyl methoxycinnamate butyl methoxydibenzoylmethane octocrylene avobenzone homosalate
Olay Complete All Day UV Moisturizer,1 sodium water glycerin dimethicone acetate tocopheryl palmitate ethylhexyl methoxycinnamate retinyl salicylate butyl methoxydibenzoylmethane ingredient octocrylene name metabisulfite cyprolactin known percent
Nivea Sun Protectivity Essence SPF 30,1 water acetate tocopheryl benzoate ethylhexyl crosspolymer aqua acrylates acrylate alkyl methoxycinnamate hexyl butyl methoxydibenzoylmethane hydroxybenzoyl diethylamino nivea ethylhexyloxyphenol methoxyphenyl triazine triazone essence protectivity
Banana Boat Sport Performance SPF 30,1 alcohol water butyl methoxydibenzoylmethane banana denatured octylcrylene parsol diethyltoluenediamine boat sport performance
Ives Clear Complexion SPF 25,1 extract water glycol acid edta disodium phenoxyethanol leaf butylene seed copolymer citric ethylhexyl acrylates cyclopentasiloxane titanium dioxide silica jojoba hydrogenated methoxycinnamate caprylyl chinensis simmondsia methicone camellia sinensis methacrylate octocrylene polyisobutene oleracea polymethyl portulaca peg-30 dipolyhydroxystearate
Aveeno Protect + Hydrate Facial Moisturizer SPF 30,1 sodium alcohol water glycerin glycol dimethicone fragrance edta disodium phenoxyethanol stearate cetearyl methylparaben glyceryl chloride acetate cetyl butylene tocopheryl copolymer propylparaben acrylate peg-100 butylparaben hyaluronate petrolatum taurate urea acryloyldimethyl isohexadecane behentrimonium alpha menthol isomethyl ionone imidazolidinyl
Nivea Sun Protectivity Daily Cream SPF 50,1 alcohol water glycerin fragrance phenoxyethanol cetyl benzoate ethylhexyl cyclopentasiloxane titanium dioxide methoxycinnamate stearyl hexyl butyl methoxydibenzoylmethane hydroxybenzoyl diethylamino ethylhexyloxyphenol methoxyphenyl triazine octyl triazone
SkinMedica Total Defense + Repair SPF 30,1 oxide zinc octinoxate avobenzone oxybenzone homosalate helioplex
Garnier SkinActive Clearly Brighter UV Moisturizer,1 water glycerin acid aloe leaf panthenol barbadensis juice vitamin lactic squalane glycolic johnson garnier chemical fabricant
Neutrogena Ultra Sheer Face And Body Sunscreen SPF 100,1 sodium extract alcohol water glycerin glycol fragrance edta phenoxyethanol leaf propylene benzoate copolymer ethylhexyl aqua acrylates acrylate xanthan parfum flower alkyl mineral tetrasodium taurate officinalis acryloyldimethyl salicylate dicaprylyl carbonate caprylyl hydroxyethyl octocrylene homosalate methoxycrylene styrene butyloctyl sunscreen inactive active gold australian botanics althea lonicera japonica honeysuckle
Lush's Skinfood Silky Underarm,1 fragrance butter shea olive almond lavender grapefruit sweet essential candelilla
Garnier's Skinactive Clearly Brighter,1 sodium alcohol water glycerin glycol dimethicone fragrance stearate acetate tocopheryl benzoate palmitate parfum alkyl ascorbyl phosphate ether retinyl laurate polyglyceryl denat pentaerythrityl myristyl isostearate tetraethylhexanoate peg-4 propionate
Mary Kay's Replenish Replenishing Body Wash,1 sodium water glycerin acid fragrance potassium coconut hydroxide hydrolyzed protein wheat cocoyl lauroyl tocopherol isethionate soybean glutamate cocoamphoacetate olivoyl
Olay's Total Effects Facial Anti Aging Moisturizer for Dry Skin,1 alcohol water glycerin dimethicone edta phenoxyethanol stearate cetearyl glyceryl peg-100 xanthan tetrasodium petrolatum methylisothiazolinone aluminum methylchloroisothiazolinone magnesium lanolin starch octenylsuccinate acetylated aspartate
Garnier's Skin Active Clearly Brighter Moisturizer,1 sodium water glycerin glycol dimethicone fragrance edta disodium phenoxyethanol stearate glyceryl acetate potassium butylene tocopheryl benzoate copolymer palmitate crosspolymer hydroxide olive acrylates acrylate peg-100 alkyl ascorbyl methyl methoxycinnamate taurate stearyl tocopherol retinyl product kernel acryloyldimethyl polysilicone lecithin contains methacrylate chlorphenesin avocado argania dipropylene spinosa octyl synthetic glycereth persea gratissima parabens phthalates fragrances petrochemicals ester
Garnier's Skin Active Clearly Brighter All in One Amazing Anti aging Moisturizer,1 extract aloe leaf acetate tocopheryl seed barbadensis fruit olive ascorbyl castor officinalis phosphate kernel magnesium prunus olea europaea apricot acetyl camellia sinensis green hexapeptide macadamia communis armeniaca ricinus borago ternifolia
Olay Total Effects Facial Anti Aging Moisturizer,1 glycerin vitamin natural moisturizer sunscreen light lightweight botanical pigments aromas
Olay Total Effects Facial Anti Aging Eye Moisturizer,1 sodium alcohol water glycerin dimethicone fragrance edta disodium phenoxyethanol stearate cetearyl methylparaben glyceryl acetate polysorbate propylparaben palmitate cyclopentasiloxane peg-100 carbomer ascorbyl vitamin phosphate ceteareth tocopherol retinyl
Revlon Colorsilk Beautiful Color Hair Color,1 sodium alcohol water glycol fragrance edta disodium propylene laureth cetyl urea diazolidinyl sulfite
Cover Girl TruBlend Liquid All in One Foundation,1 water glycerin dimethicone fragrance edta disodium phenoxyethanol cetyl palmitate ethylhexyl crosspolymer cyclopentasiloxane titanium dioxide sorbitan silica iron oxides isopropyl mica sostearate disteardimonium hectorite pentaerythrityl cyclomethicone polymethylsilsesquioxane boron nitride tetraisostearate sesqu peg-9 polydimethylsiloxyethyl trimethylsiloxy
Bobbi Brown Hydrating Foundation,1 sodium water glycerin fragrance edta phenoxyethanol polysorbate hyaluronate ethylhexylglycerin mineral tetrasodium octocrylene
L'oreal Paris Infallible Pro Glow Foundation,1 water glycol dimethicone fragrance edta disodium propylene butylene copolymer aqua acrylate cyclopentasiloxane parfum beeswax ethylhexylglycerin ammonium aluminum magnesium polyglyceryl carbonate triethoxycaprylylsilane sostearate disteardimonium hectorite alba phenyl trimethicone silicate methicone starch isododecane octenylsuccinate cera acrylamide foundation infallible glow cire abeille
Cover Girl TruBlend Liquid All in One Foundation,1 water glycerin glycol dimethicone edta disodium phenoxyethanol methylparaben acetate butylene tocopheryl propylparaben palmitate crosspolymer cyclopentasiloxane lauryl hydrolyzed butylparaben silica protein wheat beeswax ethylparaben lauroyl peg-10 isobutylparaben hexyl retinyl laurate isohexadecane polysilicone triethoxycaprylylsilane methacrylate polymethylsilsesquioxane silylate lysine dimethacrylate
Revlon Colorsilk Beautiful Color Hair Color,1 water fragrance tetrasodium ammonium lauroyl lysine pyrophosphate persulfate oleth butyleneglycol
Estee Lauder Double Wear Stay in Place Makeup,1 liquid clinique matte foundation stay estee lauder makeup mousse broad spectrum double wear place
Clinique Stay~Matte Oil Free Makeup,1 sodium water glycol acid dimethicone stearate chloride copolymer crosspolymer acrylates cyclopentasiloxane titanium dioxide stearic silica iron oxides oxide aluminum mica polysilicone triethoxycaprylylsilane phenyl trimethicone alumina yellow isononanoate isononyl calcium neopentyl blue ferric ferrocyanide chromium greens violet lake diphenyl adipic disilicate carmine bismuth oxychloride ultramarines polysilicase manganese polysilase
Maybelline Fit Me! Matte + Poreless,1 sodium water glycol acid dimethicone propylene butylene palmitate ethylhexyl silica iron oxides oxide magnesium carbonate triethoxycaprylylsilane disteardimonium hectorite silicate methicone peg-12 alumina isononanoate isononyl polymethylsilsesquioxane dicaprylate neopentyl dicaprate dehydroacetic hydrated trihydroxystearin chromium greens
L'Oreal Paris Infallible Pro~Glow Foundation,1 glycol acid dimethicone copolymer cyclopentasiloxane titanium dioxide silica iron oxides oxide peg-10 mica polyglyceryl sostearate benzophenone disteardimonium hectorite pentaerythrityl phenyl trimethicone peg-12 copolyol dicaprylate synthetic tetraethylhexanoate tetraisostearate dicaprate silylate smdi diglyceryl polyacyladipate polyhydroxystearic fluorphlogopite dipentaerythrityl sononanoin polybutylene
Forest Essentials Forest Essentials Pure Rosewater Facial Toner,1 extract water glycerin glycol phenoxyethanol aloe leaf polysorbate seed aqua barbadensis fruit beeswax ethylhexylglycerin rose honey cucumber grape caprylyl contains vitis vinifera cucumis sativus chamomilla recutita matricaria
Forest Essentials Jojoba Oil Toner,1 water jojoba
Forest Essentials pH Balanced Toner,1 fragrance aloe olive lavender lemon orange rose sunflower hydroxyethylcellulose rosemary ingredients chamomile tree calendula pomegranate sage marula toner parsley thyme forest essentials diluent geranium primrose plantain burdock yarrow nettle comfrey baobab horsetail larch blossom balanced
Forest Essentials Aloe Vera Products,1 water aloe vera product this recommended avoid pregnant breast
Forest Essentials Rose Water Facial Toner,1 extract water aloe leaf vera organic juice lavender lemon rose rosemary essential tree peppermint lime distilled balm lemongrass poppyseed certified
Forest Essentials Rosewater,1 extract glycol acid aloe butter butylene seed shea vera fruit olive stearic juice sorbitol flower jojoba sunflower kernel ascorbic prunus apricot helianthus annuus armeniaca arnica montana earth carrageenan
Forest Essentials Rosewater Facial Toner,1 water glycerin fragrance phenoxyethanol polysorbate carbomer rose product ingredients this propanediol toner topical
Forest Essentials Refreshing Toner,1 extract alcohol water glycerin aloe leaf vera juice lemon cucumber
Jovees Royal Silk Cream SPF 15,1 extract water glycerin acid dimethicone fragrance edta disodium stearate aloe leaf glyceryl butter acetate cetyl tocopheryl seed ethylhexyl crosspolymer hydroxide shea barbadensis fruit cyclopentasiloxane xanthan titanium dioxide parfum hydrolyzed citrus methyl hydrogenated peel butyrospermum park dulcis aluminum sunflower lactic kernel dicaprylyl aurantium carbonate triethoxycaprylylsilane coco vinyl squalane octocrylene ethylhexyloxyphenol methoxyphenyl triazine argania helianthus annuus spinosa glycerides bark collagen methoxy cinnamate maltodextrin triclosan cinnamomum cassia
Jovees Skin Defense Cream SPF 45,1 titanium dioxide oxide zinc cream skin contains octinoxate jovees defense
Jovees Pure Coconut Primer SPF 40,1 sodium alcohol glycol dimethicone fragrance edta disodium phenoxyethanol stearate cetearyl glyceryl polysorbate cetyl potassium butylene benzoate copolymer coconut ethylhexyl aqua sorbate acrylates acrylate benzyl sorbitol beeswax methyl methoxycinnamate taurate isopropyl aluminum acryloyldimethyl polyglyceryl glucose myristate sostearate pentaerythrityl starch dioleate octenylsuccinate tetraisostearate octylacrylamide cosmetics
Jovees Coconut Fairness Cream SPF 15 PA+,1 sodium extract alcohol water dimethicone stearate cetearyl glyceryl polysorbate copolymer ethylhexyl fruit acrylate peg-100 allantoin iron methoxycinnamate oxide glucoside salicylate acryloyldimethyltaurate cocos nucifera yellow black triazone
Innisfree Sun Cream SPF 50 PA+,1 sodium extract glycol dimethicone aloe leaf butylene benzoate ethylhexyl barbadensis cyclopentasiloxane titanium dioxide hyaluronate flower lavender methoxycinnamate officinalis hexyl salicylate rosemary root butyl methoxydibenzoylmethane lavandula angustifolia powder alba soybean phenyl trimethicone hydroxybenzoyl diethylamino ferment glycyrrhiza glabra licorice rosmarinus cyclohexasiloxane bark acetylated oleracea ursi lactobacillus arctostaphylos portulaca morus scutellaria baicalensis paeonia suffruticosa chrysanthemum morifolium
GLORY SKIN WHITENING,1 glycol acid edta disodium methylparaben sulfate propylene polysorbate titanium dioxide parfum petrolatum aluminum magnesium hydroxyethylcellulose silicate isobutane ethylenediaminetetraacetic hexane
LILIANA SKIN WHITENING,1 sodium extract water glycerin acid aloe potassium citric vera sorbate hydrolyzed protein citrate mentha arvensis thymol
LILY SKIN WHITENING,1 sodium water glycerin glycol fragrance edta disodium phenoxyethanol methylparaben propylene chloride potassium butylene sorbate allantoin sorbitol tetrasodium citrate polyquaternium skin ingredient niacinamide cellulose lily element
LILY SKIN WHITENING LOTION,1 extract alcohol allantoin mineral tree parsley artemisia absinthium soda paraben material
LILY SKIN WHITENING CREAM,1 extract niacinamide tetrahexyldecyl ascorbate lilybaeum japonicum
LILY SKIN WHITENING GEL,1 water acid acetate propylparaben tocopherol ascorbic ethoxydiglycol
VANARAS SKIN WHITENING,1 sodium alcohol glycerin glycol acid edta disodium phenoxyethanol cetearyl sulfate propylene laureth betaine cocamidopropyl peg-100 stearic distearate polyquaternium peg-150 inci hydroxyethanol
VANARAS SKIN WHITENING LOTION,1 sodium alcohol water glycerin glycol aloe methylparaben propylene hydroxide vera benzyl butylparaben ethylparaben isopropyl hydroxyethyl cellulose carbopol
URBAN DERMA SKIN WHITENING CREAM,1 retinol tetracaprylin
URBAN DERMA SKIN WHITENING LOTION,1 sodium alcohol water glycerin glycol fragrance edta disodium stearate cetearyl methylparaben propylene polysorbate propylparaben carbomer sorbitol triethanolamine ceteareth
Eucerin Nighttime Restoring Face Creme,1 sodium alcohol water glycerin glycol dimethicone fragrance edta disodium stearate cetearyl methylparaben glyceryl acetate tocopheryl propylparaben palmitate sorbitan hyaluronate allantoin mineral petrolatum isopropyl bisabolol ceteth
L'Occitane Immortelle Precious Cream,1 acid fragrance butter seed palmitate aqua ascorbyl prunus cocoa apricot rice bran hyaluronic sativa armeniaca theobroma cacao oryza
Olay Regenerist Night Recovery Cream,1 alcohol water glycerin dimethicone edta disodium phenoxyethanol stearate cetearyl glyceryl acetate polysorbate laureth tocopheryl seed palmitate ethylhexyl peg-100 carbomer butylparaben jojoba ethylparaben tetrasodium petrolatum stearyl ceteareth isobutylparaben retinyl chinensis simmondsia dimethiconol polyacrylamide copolyol isoparaffin
Vaseline Intensive Care Advanced Repair,1 alcohol water glycerin dimethicone fragrance edta phenoxyethanol aloe methylparaben leaf acetate cetyl tocopheryl propylparaben panthenol crosspolymer barbadensis acrylates acrylate peg-100 carbomer juice alkyl mineral petrolatum lanolin myristate
Peter Thomas Roth Mega~Rich Body Cream,1 water dimethicone glyceryl butter shea fruit olive lauryl citrus almond peel butyrospermum park orange dulcis kernel laurate aurantium prunus olea europaea sweet apricot amygdalus armeniaca caprylate cymbopogon martini palmarosa
Rice Bran Oil,1 sodium extract alcohol glycerin glycol acid phenoxyethanol cetearyl methylparaben polysorbate propylparaben citric aqua parfum lauryl butylparaben sorbitol flower ethylparaben castor hydrogenated distearate isobutylparaben olea europaea peg-40 rosa sulphate damascena sucrose beta glucan
Palmer's Coconut Oil Formula Massage,1 fragrance coconut lavender mineral palm essential
Best Vitamin E Oil,1 almond vitamin sweet
Avon Anew Platinum Cream,1 alcohol water glycol phenoxyethanol stearate cetearyl methylparaben glyceryl propylene cetyl palmitate benzyl parfum sorbitan butylparaben allantoin ethylparaben linalool caprylic capric isobutylparaben tocopherol hexyl retinyl glucoside oleate triglyceride limonene dmdm hydantoin cocamide alpha iodopropynyl butylcarbamate hydroxyethyl isomethyl ionone cinnamal isononanoate riboflavin
Olay Total Effects 7~In~1 Repair Cream,1 sodium alcohol water glycerin dimethicone fragrance edta disodium phenoxyethanol stearate methylparaben glyceryl cetyl propylparaben hydroxide peg-100 carbomer mineral petrolatum triethanolamine stearyl ceteareth isopropyl myristate
L'oreal Paris Youth Code Essentials 7~In~1 Youth Renewal Night Cream,1 sodium alcohol glycerin fragrance phenoxyethanol aloe butter chloride panthenol parfum allantoin wheat ascorbyl methyl cocoyl distearate phosphate peg-8 cocoa caprylyl quaternium hydroxypropyl bran methylcellulose behenyl moisturizer alanine silk peptides superfine silicone methylluanetriol capryl straw glycosides lauatriol
Eucerin Q10 Anti~Wrinkle Sensitive Care,1 sodium alcohol water glycerin acid dimethicone phenoxyethanol cetearyl polysorbate potassium benzoate copolymer citric hydroxide aqua sorbate acrylate hyaluronate ethylhexylglycerin taurate ceteareth acryloyldimethyl hydroxyethyl behenyl
Clinique Anti~Blemish Solutions Liquid Makeup,1 acid salicylic peroxide benzoyl parabens gluten sulfates
Garnier Skin Naturals Moisture Rescue Refreshing Gel Cream,1 sodium alcohol water glycerin glycol cetearyl methylparaben butter chloride cetyl seed benzoate propylparaben shea iron butyrospermum park oxide zinc cocoa pentylene cetrimonium theobroma cacao
L'oreal Age Perfect Cell Renewal Miracle Blur,1 sodium extract alcohol water glycerin glycol acid dimethicone phenoxyethanol acetate cetyl butylene tocopheryl benzoate palmitate coconut ethylhexyl crosspolymer titanium dioxide parfum stearic silica iron ascorbyl oxides phosphate mica magnesium dicaprylyl carbonate lecithin powder pentylene silicate avocado cocos nucifera hexapeptide talc copper persea gratissima myristoyl esters bismuth oxychloride ultramarines rhododendron ferrugineum alcohols
Olay Total Effects Anti~Aging Night Cream,1 sodium alcohol water glycerin glycol dimethicone fragrance edta disodium phenoxyethanol stearate cetearyl glyceryl polysorbate butylene copolymer acrylates peg-100 caprylate
Lancome Teint Idole Ultra Wearables Concealer,1 acid dimethicone phenoxyethanol crosspolymer hydroxide cyclopentasiloxane silica oxide aluminum mica polyglyceryl propanediol sostearate disteardimonium hectorite vinyl polyethylene sorbic synthetic fluorphlogopite ultra lancôme teint idole wearables concealer ptfe elastomer
Olay Regenerist Micro~Sculpting Cream,1 sodium extract alcohol water glycerin glycol cetearyl methylparaben propylene acetate cetyl potassium tocopheryl seed propylparaben butylparaben allantoin jojoba methyl ethylparaben petrolatum castor cocoyl hydrogenated taurate phosphate chinensis simmondsia peg-60
Birla Shringar Skin Moisturizer,1 water glycerin butter kaolin shea vitamin powder menthol argan neem amla besan
Botanics Skin Moisturizer,1 aloe coconut vera almond jojoba sweet
Blue Herbal Skin Moisturizer,1 extract alcohol water glycerin acid stearate leaf glyceryl cetyl crosspolymer acrylates acrylate benzyl xanthan alkyl methylisothiazolinone methylchloroisothiazolinone dmdm hydantoin hyaluronic eucalyptus globulus poloxamer
Biotique Skin Moisturizer,1 fragrance rose skin ingredients biotique natural chamomile moringa oils seeds moisturizer petals moisture benefits balance properties hydration include help nourish mild moisturizes maintains what moisturizer? maintain healthy levels provide provides
Biogreen Skin Moisturizer,1 extract aloe butter coconut shea vera wheat rosemary palm cocoa rice bran germ
Bare Balance Skin Moisturizer,1 water aloe leaf butter coconut shea vera juice lavender jojoba beeswax essential
Clinique Skin Moisturizer,1 sodium extract alcohol water glycerin glycol acid edta disodium phenoxyethanol stearate aloe methylparaben leaf propylene chloride acetate butylene tocopheryl copolymer propylparaben palmitate barbadensis acrylates peg-100 xanthan carbomer sorbitol mineral petrolatum distearate urea lauroyl isobutylparaben retinyl hydroxyethylcellulose ascorbic lanolin lactylate cellulose jelly petroleum
Cetaphil Skin Moisturizer,1 alcohol water glycerin dimethicone edta disodium stearate cetearyl methylparaben glyceryl cetyl propylparaben xanthan stearyl urea aluminum caprylic capric magnesium triglyceride behentrimonium diazolidinyl silicate methosulfate
Cetaphil Skin Moisturizer,1 sodium alcohol water glycerin glycol acid dimethicone fragrance edta phenoxyethanol cetearyl methylparaben butter propylene polysorbate cetyl potassium seed benzoate propylparaben citric coconut shea olive sorbate benzyl titanium dioxide carbomer stearic almond protein sorbitol wheat lavender jojoba beeswax triethanolamine orange stearyl sunflower hydroxyethylcellulose lanolin grapefruit behentrimonium dmdm hydantoin sweet grape essential soybean alumina avocado methosulfate oils glycyrrhizate simethicone dipotassium sulfite gluconate pumpkin chlorhexidine avacado
