Clean & Clear Skin Moisturizer,1 sodium water glycerin glycol dimethicone phenoxyethanol cetearyl methylparaben sulfate propylene butylene copolymer propylparaben crosspolymer cyclopentasiloxane butylparaben ethylparaben ammonium isobutylparaben acryloyldimethyltaurate cyclohexasiloxane isododecane isopropylparaben
Nivea Body Milk,1 sodium extract water glycerin glycol acid dimethicone phenoxyethanol stearate aloe methylparaben leaf sulfate glyceryl chloride laureth propylparaben citric panthenol barbadensis peg-100 butylparaben allantoin distearate lauroyl lactic root cocamide sarcosinate cetrimonium glycyrrhiza glabra copolyol mipa ethanol cacamide
Olay Body Milk,1 sodium alcohol water acid dimethicone edta disodium phenoxyethanol stearate cetearyl methylparaben sulfate glyceryl butter acetate polysorbate laureth tocopheryl propylparaben palmitate citric betaine hydroxide shea cocamidopropyl peg-100 hydrolyzed protein wheat ethylparaben petrolatum butyrospermum park isopropyl retinyl steareth ascorbic hydroxypropyl cocoamphoacetate mannitol peg-2 oleamine cocodimonium
Dove Body Milk,1 sodium extract alcohol water glycerin glycol acid dimethicone fragrance phenoxyethanol stearate glyceryl propylene cetyl seed panthenol coconut benzyl peg-100 stearic jojoba castor hydrogenated ceteareth polyquaternium propanediol peg-40 chinensis simmondsia algae lauric pantolactone
Vaseline Body Milk,1 sodium extract alcohol glycerin acid fragrance stearate aloe cetearyl leaf glyceryl acetate cetyl tocopheryl palmitate citric panthenol barbadensis benzyl stearic sorbitan allantoin ethylhexylglycerin ascorbyl mineral methyl petrolatum cocoyl taurate retinyl laurate lanolin peg-40 monostearate yellow blue oleic includes vaseline hexylresorcinol
Eucerin Body Milk,1 sodium alcohol water glycerin acid stearate cetearyl sulfate glyceryl acetate cetyl tocopheryl parfum stearic mineral petrolatum citrate lanolin bisabolol
Nivea Lip Care Body Milk,1 sodium alcohol water glycerin acid fragrance phenoxyethanol stearate cetearyl sulfate glyceryl butter acetate cetyl potassium tocopheryl citric hydroxide shea sorbate peg-100 xanthan lauryl sorbitan ethylhexylglycerin vitamin butyrospermum park distearate caprylic capric triglyceride sesquioleate cyclomethicone
Nivea Lip Butter Body Milk,1 sodium water glycerin glycol acid fragrance phenoxyethanol stearate aloe leaf sulfate glyceryl butter propylene chloride potassium butylene barbadensis peg-100 xanthan parfum lauryl stearic juice beeswax mineral ethylparaben citrate caprylic capric sunflower lactic tocopherol triglyceride peg-8 lanolin monostearate milk nivea tree lauric butylphenyl methylpropional palmitic body ethylene melaleuca oleic linoleic alternifolia isobutane esters butane
Nivea Men Body Milk,1 water glycerin fragrance edta disodium acetate polysorbate tocopheryl sorbitan petrolatum ceteareth methylisothiazolinone methylchloroisothiazolinone oleate isohexadecane squalane face milk nivea body wash
Nivea Deodorant Body Milk,1 sodium extract alcohol water glycerin glycol acid edta disodium aloe butter chloride potassium butylene benzoate citric coconut vera aqua fruit olive sorbate organic juice citrus lavender castor peel officinalis citrate dulcis rose caprylic capric aurantium root triglyceride palm cucumber grape lavandula licorice salt nobilis sugar oatmeal pogostemon cablin grandis cinnamon vanilla ethanol paint ginger tangerina linseed pine ethyl nasal spray alcoholic wine cane pigment varnish girl ease peanut needles hydrochloric trometamol potasssium oats olives eczema noni hips anionic cationic polymers peanuts
VLCC Facial Kit,1 cream mask lotion
VLCC Wild Berry,1 alcohol water glycerin glycol acid fragrance edta disodium phenoxyethanol methylparaben propylene potassium citric sorbate benzyl butylparaben sorbitol ethylparaben tetrasodium castor hydrogenated peg-40 polyethylene denatured
VLCC Golden Glow,1 glycerin acid butter panthenol shea jojoba lemon mandelic
VLCC Honey and Hibiscus,1 honey hibiscus bergamot marigold caviar
L'Oreal Pure~Clay Purifying Mask,1 sodium kaolin organic lavender bentonite powder charcoal green clay montmorillonite moroccan lava french bicarbonate
Olay Regenerist Serum,1 sodium water glycerin glycol acid dimethicone edta disodium phenoxyethanol propylene acetate potassium tocopheryl palmitate panthenol ethylhexyl sorbate hydrolyzed protein allantoin ascorbyl methoxycinnamate polyacrylate palmitoyl acetyl niacinamide tetrapeptide peg-12 hexapeptide oligopeptide retinol copper glycyrrhetinic peptides pentapeptide resveratrol maize
Dove Quench Absolute Dry Oil,1 sodium alcohol water fragrance cetearyl chloride polysorbate palmitate coconut aqua olive parfum hyaluronate linalool isopropyl glucoside limonene steareth citronellol geraniol guar hydroxypropyltrimonium acetylated citral
Shiseido Revitalizing Supreme,1 sodium alcohol water glycerin acid dimethicone acetate tocopheryl palmitate panthenol ethylhexyl hydrolyzed protein allantoin ascorbyl methoxycinnamate denat polyacrylate palmitoyl niacinamide tetrapeptide peg-12 oligopeptide retinol copper glycyrrhetinic peptides pentapeptide maize
VLCC Papaya and Herbal,1 sodium extract alcohol water glycerin glycol acid edta disodium phenoxyethanol stearate cetearyl methylparaben glyceryl propylene polysorbate cetyl propylparaben fruit stearic sorbitan hydrolyzed protein wheat stearyl urea root turmeric diazolidinyl papaya yellow includes vlcc ethyl herbal hydroxymethylglycinate roots
VLCC Khanda Khanda,1 water glycerin glycol dimethicone butylene isohexadecane ingredients vlcc khanda gylcol
VLCC Face Cream,1 extract alcohol water glycerin acid aloe cetearyl methylparaben cetyl propylparaben vera olive stearic behentrimonium methosulfate distilled
VLCC Eye Cream,1 sodium water glycerin acid edta disodium methylparaben sulfate chloride acetate laureth copolymer propylparaben acrylates carbomer butylparaben iron triethanolamine oxides salicylic
VLCC Body Lotion,1 alcohol methylparaben stearyl ingredients alcoholmethylparaben inorganic
VLCC Body Lotion,1 alcohol methylparaben stearyl
VLCC Rose Gold Face Mist,1 alcohol water glycol fragrance methylparaben propylene butylene propylparaben castor hydrogenated urea diazolidinyl peg-40
Patanjali Saundarya Aloe Vera Gel,1 water glycerin aloe panthenol vera tocopherol chlorphenesin
Patanjali Saundarya Raw Banana,1 aloe vera wheat honey neem peppermint banana cinnamon leaves grass
Patanjali Saundarya Anti Acne Powder,1 honey turmeric patanjali tulsi eucalyptus clove black yogurt cinnamon basil pepper coriander holy bala aralia keertikka pippali kakroli
Patanjali Saundarya Sunflower Oil,1 product skin ingredients this contains beauty that deep does contain considered dangerous ewg's database
Chandan Aerosol,1 alcohol water benzoate benzyl linalool limonene citronellol alpha isomethyl ionone geraniol butylphenyl methylpropional perfume coumarin hydroxycitronellal
Patanjali Saundarya Sattu,1 almond rose skin seeds black sesame petals light multani mitti pure dalchini moti elaichi kesar kasturi weight scent refine
Patanjali Saundarya Hair Care,1 coconut olive castor olea europaea cocos nucifera communis ricinus henna lawsonia inermis lavangal lavangatmaka lavangkashaya lavangurdhi lavangvisharadi
Patanjali Saundarya Tulsi Tulsi and Brahmi,1 patanjali tulsi brahmi saundarya
Soothing Aloe Green Clay Mask,1 water glycerin aloe leaf kaolin barbadensis juice bentonite green clay
Activated Charcoal & Olive Facial Mask,1 extract alcohol fragrance aloe cetearyl leaf butter cetyl seed palmitate ethylhexyl shea barbadensis olive xanthan juice citrus allantoin sorbitol flower lavender jojoba ethylhexylglycerin castor hydrogenated peel butyrospermum park officinalis orange dulcis methylisothiazolinone methylchloroisothiazolinone kernel hydroxyethylcellulose rosemary aurantium grape propanediol peg-40 lavandula angustifolia chinensis simmondsia charcoal vitis vinifera activated argania helianthus annuus spinosa rosmarinus pelargonium graveolens buteth sclerotium
Charcoal & Spirulina Facial Mask,1 extract lavender vitamin rosemary bentonite charcoal algae green arnica ursi spirulina buckthorn echinacea marshmallow self heal
Facial Toner,1 alcohol water glycol acid dimethicone cetearyl polysorbate butylene citric carbomer triethanolamine resveratrol
Activated Charcoal & Olive Facial Mask,1 alcohol aloe vera olive skin charcoal activated clear formula free gently cleanse hydrate designed exfoliate
Activated Charcoal & Spirulina Facial Mask,1 charcoal activated facial mask spirulina
Soothing Aloe Facial Mask,1 sodium extract alcohol water glycerin glycol fragrance edta disodium aloe cetearyl sulfate propylene acetate polysorbate cetyl tocopheryl vera aqua benzyl xanthan parfum hyaluronate ethylhexylglycerin product skin this contains ingredient yellow pore irritant
Activated Charcoal & Olive Facial Mask,1 olive lavender charcoal activated
Activated Charcoal & Spirulina Facial Mask,1 charcoal activated facial mask spirulina
L'Oréal Paris Shiny hair,1 sodium water glycol fragrance edta sulfate chloride laureth betaine cocamidopropyl tetrasodium distearate oxide ammonium methylisothiazolinone methylchloroisothiazolinone cocamide peroxide cocamidopropylamine hydrogen
L'Oréal Paris Dry hair,1 alcohol water glycerin dimethicone fragrance cetearyl chloride panthenol aqua distearate methylisothiazolinone polyquaternium methylchloroisothiazolinone peg-8 lanolin behentrimonium peg-60
L'Oréal Paris Frizzy hair,1 sodium alcohol water glycerin glycol acid fragrance edta disodium cetearyl sulfate chloride polysorbate laureth butylene palmitate citric ethylhexyl ether isopropyl dmdm hydantoin hair complex frizzy methoxyethyl
L'Oréal Paris Brittle hair,1 sodium water glycerin glycol fragrance edta disodium methylparaben propylene chloride propylparaben panthenol betaine cocamidopropyl tetrasodium hydroxyethylcellulose peg-8 cocoamphodipropionate peg-55
L'Oréal Paris Weak hair,1 sodium water fragrance methylparaben sulfate polysorbate laureth propylparaben isopropyl dmdm hydantoin myristate iodopropynyl butylcarbamate
L'Oréal Paris L'Oréal Paris Total Repair 5 Reconstructor,1 water glycerin dimethicone fragrance chloride copolymer hydrolyzed polyquaternium behentrimonium benzophenone collagen undeceth
Nioxin 3,1 alcohol water glycol propylene cetyl urea ingredients diazolidinyl that make nioxin
TIGI Organics Purify Shampoo,1 extract aloe vera honey grapefruit extractaloe
TIGI Organics Purify Shampoo,1 extract aloe vera lavender jojoba honey rosemary grapefruit sage
TIGI Organics Purify Conditioner,1 extract alcohol water fragrance edta disodium cetearyl glyceryl chloride potassium panthenol betaine cocamidopropyl benzyl protein flower wheat ethylhexylglycerin glucoside oleate limonene behentrimonium cetrimonium methosulfate nobilis decyl anthemis aroma hydrolized
TIGI Organics Couple's Set,1 extract aloe leaf seed coconut olive organic juice protein lavender jojoba sunflower rosemary argan avocado quinoa apple vinegar cider bulgarian
TIGI Organics Wavies,1 extract coconut olive protein wheat beeswax rosemary avocado strawberry
John Frieda Frizz Ease,1 water dimethicone fragrance sulfate chloride laureth potassium xanthan lauryl ethylhexylglycerin triethanolamine ammonium peg-32 peg-14m butane ease john frieda frizz
John Frieda Frizz Ease Thickening Lotion,1 sodium alcohol water glycerin acid dimethicone fragrance edta disodium cetearyl chloride acetate tocopheryl seed panthenol crosspolymer acrylates acrylate benzyl alkyl jojoba ethylparaben ceteareth lactic lanolin natural chinensis simmondsia cyclomethicone metabisulfite flaxseed distearyldimonium peg-50
Kamalaya Kawa Kawa Shampoo and Conditioner,1 sodium water glycerin glycol acid fragrance propylene chloride citric betaine aqua cocamidopropyl parfum lauryl polyquaternium lauroyl cocamide sarcosinate pentaerythrityl purified guar hydroxypropyltrimonium shampoo peg-150 conditioner sulfoacetate kawa tetrastearate kamalaya lauramide
Herbal Essences Hello Hydration Shampoo,1 extract fragrance panthenol quinoa
Conditioner,1 alcohol water dimethicone fragrance stearate cetearyl methylparaben glyceryl acetate tocopheryl propylparaben aqua dmdm hydantoin cocamide cocoate iodopropynyl butylcarbamate peg-7 purified peg-200
Body Wash,1 water glycerin coconut kernel palm ingredients purified body wash
Mizani True Textures Naturals Shampoo and Conditioner,1 sodium alcohol water glycerin glycol acid fragrance edta phenoxyethanol sulfate chloride acetate laureth tocopheryl citric panthenol betaine cocamidopropyl carbomer hydrolyzed protein wheat methyl tetrasodium distearate denat glucose cocamide dioleate peg-120 octapeptide
Himalaya Herbals Purifying Neem Scrub,1 sodium extract water glycerin fragrance disodium methylparaben leaf chloride acetate polysorbate laureth tocopheryl copolymer propylparaben betaine cocamidopropyl acrylates cocoyl isethionate purified neem sulfosuccinate salt
Himalaya Herbals Soothing Aloe Herbal Face Mask,1 sodium extract alcohol water glycerin glycol acid edta disodium phenoxyethanol stearate aloe methylparaben glyceryl propylene copolymer propylparaben panthenol crosspolymer hydroxide vera acrylate peg-100 stearic sorbitan butylparaben allantoin alkyl ascorbyl ethylparaben phosphate isobutylparaben oleate bisabolol acetyl monostearate hexapeptide glycyrrhizate lime dipotassium palmitic sulfonate emulsifier acidum lacticum tetradecene polystyrene
Himalaya Herbals Purifying Neem Scrub,1 water glycerin leaf kaolin flower lavender neem peppermint clove bark
Himalaya Herbals Soothing Aloe Herbal Face Mask,1 sodium extract water glycerin glycol fragrance edta phenoxyethanol aloe methylparaben leaf butylene propylparaben kaolin palmitate barbadensis juice ascorbyl tetrasodium tocopherol acetyl purified chlorphenesin face mask ascorbate retinol himalaya herbals cysteine herbal
Himalaya Herbals Soothing Aloe Herbal Face Mask,1 sodium extract alcohol water glycerin glycol acid edta disodium phenoxyethanol aloe cetearyl leaf sulfate propylene chloride laureth potassium crosspolymer hydroxide barbadensis sorbate acrylates acrylate juice flower alkyl camellia sinensis clove eugenia caryophyllus myristic
Lush Fresh Cream,1 butter shea jojoba cream lush fresh
Kama Sutra Wise Cooling Cucumber Gel,1 alcohol water acid fragrance stearate aloe cetearyl methylparaben leaf glyceryl cetyl potassium propylparaben citric barbadensis sorbate xanthan stearic juice ether myristyl hydroxypropyl guar propionate
L'Oreal Paris Advanced Suncare Sensitive Skin Sunscreen Cream for Very Dry Skin,1 sodium water phenoxyethanol ethylhexyl cyclopentasiloxane hyaluronate methoxycinnamate butyl methoxydibenzoylmethane octocrylene ethylhexyloxyphenol methoxyphenyl triazine
Nivea Daily Protective Emulsion SPF 20,1 sodium alcohol water glycerin glycol dimethicone phenoxyethanol methylparaben sulfate polysorbate potassium butylene benzoate copolymer propylparaben coconut crosspolymer hydroxide sorbate acrylates cyclopentasiloxane xanthan sorbitan butylparaben silica ethylparaben hydrogenated ammonium peg-10 isobutylparaben magnesium polyacrylate isohexadecane ingredients sostearate caprylyl vinyl phenyl trimethicone methicone acryloyldimethyltaurate polyethylene liquidum polyester paraffinum ethylene persea gratissima sesqu carnauba silsesquioxane clear polydecene cerifera makeup malate sostearyl almay complexion methicillin copernicia ethylpar
Neutrogena Hydroboost Hydrating Lightweight Moisturizer,1 sodium alcohol water glycerin dimethicone fragrance edta disodium stearate cetearyl glyceryl acetate tocopheryl panthenol coconut crosspolymer carbomer hyaluronate chamomile cocos nucifera nobilis anthemis peg-32
Olay ProX Deep Moisture Night,1 extract acid aloe hyaluronic moisture night deep olay prox
Julep Gel Hydrating Rich Face Moisturizer,1 sodium extract alcohol water glycerin glycol edta disodium phenoxyethanol stearate cetearyl leaf glyceryl butter acetate tocopheryl seed shea peg-100 allantoin sorbitol ethylhexylglycerin hydrogenated butyrospermum park officinalis lauroyl glucoside hydroxyethylcellulose rosemary root peg-8 grape caprylyl alba acetyl vegetable hexylene vitis vinifera glycyrrhiza glabra licorice rosmarinus lactylate talc glucosamine betula birch
Lakmé Eyeconic Kajal,1 alcohol crosspolymer acrylate iron alkyl oxide ingredient polyvinyl
Max Factor Kajal,1 sodium alcohol water glycol acid edta disodium phenoxyethanol stearate glyceryl acetate polysorbate cetyl butylene tocopheryl copolymer palmitate panthenol ethylhexyl hydroxide acrylate benzyl carbomer sorbitan sorbitol ether caprylic capric retinyl oleate triglyceride isohexadecane myristate soybean acrylic trideceth rowspan=2
Maybelline New York Kajal,1 sodium alcohol water glycol acid fragrance edta disodium phenoxyethanol methylparaben sulfate polysorbate laureth cetyl butylene copolymer propylparaben palmitate ethylhexyl acrylate titanium dioxide stearic petrolatum taurate acryloyldimethyl
L'Oreal Paris Extraordinaire Extra Volume Blow Dry Shot,1 sodium alcohol water glycerin glycol edta disodium stearate cetearyl sulfate propylene laureth methylchloroisothiazolinone dicaprylyl hydroxyethylcellulose carbonate dmdm hydantoin monoethanolamine
Kiehl's Ultra Facial Cream,1 sodium extract water glycerin aloe butter shea vera protein ascorbyl lactate squalane tetraisopalmitate wate
Kama Ayurveda Lavender Patchouli Hair Cleanser,1 water glycerin leaf coconut olive organic lavender lavandula angustifolia essential mentha vegetable peppermint piperita pogostemon cablin saponified patchouli
L'Oreal Paris Extraordinaire Anti Frizz Hair Serum,1 sodium glycerin acid edta sulfate laureth citric panthenol aqua tetrasodium polyquaternium aminomethyl propanol hydroxypropylmethylcellulose
Kiehl's Creamy Body Wash,1 sodium glycerin glycol acid edta disodium butter propylene chloride acetate tocopheryl seed panthenol aqua fruit parfum hydrolyzed protein wheat tetrasodium cocoyl butyrospermum park lactic isethionate olea europaea quaternium communis ricinus
Avene Thermal Spring Water,1 glycerin phenoxyethanol aqua carbomer l'eau l’eau
Aveda Tourmaline Charged Hydrating Lotion,1 sodium alcohol water glycerin glycol dimethicone fragrance edta disodium stearate aloe cetearyl leaf glyceryl polysorbate crosspolymer barbadensis acrylates acrylate peg-100 sorbitan juice hyaluronate alkyl polyglyceryl steareth dipropylene
Hawaiian Silky 14 Day Leave~In Conditioner,1 alcohol water glycerin fragrance cetearyl methoxycinnamate dmdm hydantoin yellow octyl hexanediol
Alterna Haircare Caviar Overnight Serum,1 alcohol water glycerin glycol acid dimethicone fragrance edta disodium phenoxyethanol cetearyl methylparaben propylene benzoate propylparaben citric ethylhexyl benzyl methoxycinnamate urea linalool ether hexyl laurate butyl methoxydibenzoylmethane myristate adipate butylphenyl methylpropional imidazolidinyl amodimethicone sopropyl isoamyl hydroxycitronellal gluconolactone cinnamic aldehyde
Aveda Smooth Infusion Style Prep,1 alcohol water glycerin dimethicone fragrance edta disodium chloride crosspolymer acrylates acrylate alkyl denat behentrimonium dmdm hydantoin cetrimonium methosulfate
Caudalie Quinoa Anti~Pollution Face Mask,1 organic lemon oxide zinc cucumber carrot green clay quinoa white apple seaweed
Shaklee B~12 Vitamin Spray,1 water vitamin product care with products shaklee company corporation household around world nutritional personal stanley first privately owned multinational headquartered pleasanton california offices makes distributes supplement cleaners established shaklee's multivitamin introduced public since expanded offer variety supplements
Caudalie Glycolic Radiance Peel,1 lemon grapefruit cucumber mint
Skinceuticals Clarifying Cleansing Gel,1 sodium alcohol water glycerin glycol acid edta disodium cetearyl methylparaben propylene polysorbate potassium butylene benzoate copolymer propylparaben sorbate benzyl xanthan ceteareth acryloyldimethyltaurate sorbic acrylamide
Good Skin by Kate Somerville,1 sodium extract water glycerin glycol phenoxyethanol butylene copolymer betaine acrylate xanthan hyaluronate taurate acryloyldimethyl acetyl algae caffeine ethylhexanoate
Maui Body Care Coconut Milk Moisturizer,1 aloe butter coconut shea olive milk
Biotique Bio Honey Water,1 water aloe vera rose honey ingredients biotique natural tulsi pure guduchi
Aqua Skin Biotique Bio Toner,1 sodium acid aqua ascorbyl phosphate glycolic
Biotique Bio Honey Water Pore Tightening Toner,1 sodium extract water glycerin aloe benzoate vera sorbitol honey purified gluconolactone
Biofficina Toscana Rosa H2O,1 sodium extract water glycerin panthenol hyaluronate allantoin flower rose acetyl rosa hexapeptide damascena
The Body Shop Water Lily Toner,1 extract alcohol water glycerin panthenol aqua parfum denat lily
Tata Harper Clarifying Toner,1 sodium extract water glycerin glycol acid phenoxyethanol aloe leaf chloride polysorbate potassium butylene seed citric barbadensis fruit sorbate juice sorbitol flower lavender methyl rose sunflower cucumber propanediol lavandula angustifolia cucumis sativus rosa helianthus annuus damascena nobilis vinegar anthemis gluceth
Moisturizer,1 alcohol water glycerin glycol acid fragrance glyceryl propylene polysorbate cetyl butylene olive stearic sorbitol petrolatum triethanolamine lanolin monostearate glycerol
Burt's Bees Moisturizer,1 sodium extract alcohol water glycerin glycol acid dimethicone fragrance edta disodium stearate aloe cetearyl leaf glyceryl propylene barbadensis organic peg-100 titanium dioxide sorbitan allantoin beeswax vitamin tocopherol hydroxyethylcellulose ascorbic lactate camellia sinensis
Lalicious Day & Night Cream,1 sodium alcohol glycerin glycol acid dimethicone aloe cetearyl leaf butter propylene palmitate ethylhexyl hydroxide shea vera sorbitan hydrolyzed juice protein butyrospermum park olivate lauric adipate cyclomethicone isostearyl ceratonia siliqua distarch myristica fragrans
The Body Shop Vitamin E Moisture Cream,1 alcohol glycerin dimethicone phenoxyethanol stearate cetearyl glyceryl butter crosspolymer shea aqua acrylates acrylate cyclopentasiloxane peg-100 parfum alkyl butyrospermum park stearyl polyglyceryl dicaprylyl carbonate caprate
L'Occitane Shea Butter Moisture Cream,1 sodium extract alcohol water glycerin glycol dimethicone fragrance stearate aloe cetearyl methylparaben leaf glyceryl butter propylene acetate polysorbate cetyl tocopheryl seed benzoate copolymer propylparaben panthenol coconut hydroxide shea barbadensis olive benzyl sorbitan juice almond jojoba castor hydrogenated triethanolamine butyrospermum park stearyl dulcis ether kernel glucoside cream isohexadecane prunus sweet grape propanediol apricot squalane chinensis simmondsia acryloyldimethyltaurate dimethiconol vitis vinifera cocos nucifera safflower amygdalus cyclomethicone armeniaca carthamus tinctorius moisture acrylamide l'occitane isoceteth
Dove Aloe Vera Gel ,1 sodium alcohol water glycerin glycol fragrance aloe methylparaben leaf propylene benzoate barbadensis benzyl juice cellulose carboxymethyl
Nivea Aloe Vera Gel ,1 sodium extract water glycerin glycol edta disodium aloe methylparaben leaf propylene benzoate barbadensis carbomer triethanolamine
Pears Aloe Vera Gel ,1 water glycerin fragrance phenoxyethanol aloe leaf barbadensis parfum juice methylisothiazolinone benzophenone
Lakme Aloe Vera Gel ,1 sodium glycerin acid dimethicone aloe leaf vera barbadensis juice citrate lactic product steareth ingredients lactate arginine beauty lakme
Faces Aloe Vera Gel ,1 sodium water glycerin acid methylparaben benzoate propylparaben citric
Vaseline Aloe Vera Gel ,1 alcohol water glycerin glycol fragrance aloe methylparaben leaf propylene barbadensis benzyl carbomer juice petrolatum castor hydrogenated urea diazolidinyl peg-40
Cetaphil Aloe Vera Gel ,1 sodium alcohol water glycerin glycol acid stearate aloe methylparaben leaf sulfate propylene cetyl propylparaben betaine barbadensis cocamidopropyl benzyl peg-100 lauryl juice allantoin ethylparaben cocoyl triethanolamine stearyl phosphate isobutylparaben isethionate ascorbic this ceteth includes dibasic
St Aloe Vera Gel ,1 water glycerin fragrance aloe methylparaben leaf potassium propylparaben barbadensis sorbate carbomer juice urea diazolidinyl camphor
Ives Aloe Vera Gel ,1 phenoxyethanol aloe vera ives
Johnson and Johnson Aloe Vera Gel ,1 sodium extract water glycerin glycol edta aloe leaf butylene copolymer barbadensis acrylates tetrasodium triethanolamine
Himalaya Herbals Purifying Neem Toner,1 sodium alcohol water acid dimethicone disodium sulfate polysorbate laureth potassium benzoate citric sorbate propanediol benzophenone neem cocoamphodiacetate glycerine toner sulfite himalaya herbals bisopropyl butoxyethanol
Himalaya Herbals Purifying Neem Face Mask,1 sodium extract water glycerin aloe leaf seed kaolin barbadensis fruit hydrolyzed juice citrus protein flower wheat cocoyl peel dulcis aurantium root alba vegetable neem acacia limon bark carthamus tinctorius melaleuca officinale alternifolia cananga odorata symphytum concinna boswellia serrata salix zingiber adhatoda vasica
