Name,Class,sodium,extract,alcohol,water,glycerin,glycol,acid,dimethicone,fragrance,edta,disodium,phenoxyethanol,stearate,aloe,cetearyl,methylparaben,leaf,sulfate,glyceryl,butter,propylene,chloride,acetate,polysorbate,laureth,cetyl,potassium,butylene,tocopheryl,seed,benzoate,copolymer,propylparaben,kaolin,palmitate,citric,panthenol,coconut,ethylhexyl,crosspolymer,betaine,hydroxide,shea,vera,aqua,barbadensis,fruit,olive,cocamidopropyl,sorbate,organic,acrylates,acrylate,cyclopentasiloxane,benzyl,peg-100,xanthan,titanium,dioxide,carbomer,parfum,lauryl,stearic,sorbitan,hydrolyzed,juice,citrus,almond,butylparaben,silica,protein,hyaluronate,allantoin,sorbitol,iron,flower,wheat,lavender,alkyl,jojoba,beeswax,ethylhexylglycerin,ascorbyl,mineral,methyl,ethylparaben,tetrasodium,vitamin,petrolatum,lemon,castor,cocoyl,hydrogenated,peel,methoxycinnamate,triethanolamine,taurate,butyrospermum,park,officinalis,orange,distearate,oxides,stearyl,citrate,oxide,phosphate,urea,linalool,ammonium,dulcis,ceteareth,methylisothiazolinone,ether,isopropyl,aluminum,polyquaternium,methylchloroisothiazolinone,lauroyl,rose,caprylic,capric,peg-10,sunflower,isobutylparaben,lactic,tocopherol,honey,hexyl,mica,retinyl,product,kernel,magnesium,laurate,acryloyldimethyl,glucoside,salicylate,polyglyceryl,oleate,dicaprylyl,denat,hydroxyethylcellulose,rosemary,aurantium,isethionate,root,triglyceride,polyacrylate,palmitoyl,zinc,turmeric,peg-8,limonene,carbonate,steareth,cream,isohexadecane,glucose,ascorbic,skin,lanolin,palm,grapefruit,ingredients,behentrimonium,butyl,cucumber,prunus,polysilicone,triethoxycaprylylsilane,methoxydibenzoylmethane,dmdm,hydantoin,olea,europaea,sweet,cocamide,myristate,this,grape,biotique,patanjali,propanediol,diazolidinyl,sostearate,peg-40,lactate,benzophenone,coco,cocoate,lavandula,cocoa,lecithin,apricot,caprylyl,natural,disteardimonium,hectorite,bentonite,vinyl,angustifolia,quaternium,bisabolol,powder,squalane,contains,sarcosinate,chinensis,essential,pentaerythrityl,alba,pentylene,soybean,myristyl,citronellol,phenyl,trimethicone,silicate,rice,alpha,acetyl,iodopropynyl,butylcarbamate,menthol,simmondsia,ingredient,salicylic,methicone,mentha,camellia,sinensis,niacinamide,tulsi,hydroxybenzoyl,peg-7,vegetable,hydroxypropyl,chamomile,methacrylate,tetrapeptide,bran,acryloyldimethyltaurate,hyaluronic,charcoal,saccharomyces,diethylamino,algae,starch,carrot,hydroxyethyl,ferment,purified,cetrimonium,glutamate,octocrylene,hexylene,peg-12,dimethiconol,vitis,vinifera,chlorphenesin,isomethyl,ionone,argan,arginine,papaya,cucumis,sativus,hair,green,rosa,olivate,alumina,face,polyisobutene,mango,avocado,neem,methosulfate,monostearate,milk,activated,sulfosuccinate,methylcellulose,nivea,chamomilla,recutita,cocos,nucifera,cinnamal,polyethylene,ethylhexyloxyphenol,methoxyphenyl,triazine,argania,hexapeptide,helianthus,annuus,dipropylene,tree,peppermint,sesquioleate,oligopeptide,octinoxate,behenyl,matricaria,geraniol,piperita,spinosa,facial,yellow,acacia,safflower,dioleate,glycyrrhiza,glabra,licorice,rosmarinus,moringa,clay,guar,hydroxypropyltrimonium,quinoa,trimethylsiloxysilicate,eucalyptus,sulphate,octyldodecanol,lactylate,avobenzone,octisalate,oxybenzone,macadamia,lauric,adipate,cyclohexasiloxane,sativa,beauty,calendula,isododecane,talc,oils,glycyrrhizate,butylphenyl,methylpropional,limnanthes,lime,shampoo,mask,liquidum,limon,amygdalus,homosalate,damascena,isononanoate,polyacrylamide,isostearate,seeds,cellulose,imidazolidinyl,amla,cyclomethicone,glycolic,communis,armeniaca,caprylate,peg-120,amodimethicone,perfume,glycerides,simethicone,cocoamphoacetate,clove,isononyl,stearoyl,octenylsuccinate,white,copolyol,ricinus,moisturizer,polymethylsilsesquioxane,calcium,arnica,bark,black,sorbic,dipotassium,palmitic,sesame,meadowfoam,salt,care,soap,trisiloxane,tetrahexyldecyl,ascorbate,octyl,polyester,cocoamphodiacetate,with,dicaprylate,paraffinum,glycerine,synthetic,yogurt,carthamus,tinctorius,tetraethylhexanoate,acetylated,boron,nitride,tetraisostearate,retinol,nobilis,sugar,coumarin,apple,glycine,corn,scrub,trisodium,sucrose,body,peg-20,pomegranate,theobroma,cacao,neopentyl,dicaprate,peg-6,copper,ceteth,hexanediol,banana,melissa,oryza,name,triazone,candelilla,sage,collagen,peg-150,beta,petals,ethylene,melaleuca,oatmeal,that,sopropyl,officinale,vulgaris,cleanser,senegal,dehydroacetate,polybutene,kajal,rubus,punica,lotion,methoxycrylene,pogostemon,cablin,fennel,saponified,glucan,pantolactone,montmorillonite,benzoic,decyl,metabisulfite,denatured,johnson,styrene,peg-4,glycereth,persea,gratissima,sesqu,peg-9,silylate,lysine,dehydroacetic,marula,montana,myristoyl,peg-60,moisture,germ,grandis,cinnamon,vanilla,vinegar,sulfonate,polyvinyl,acrylic,isoamyl,products,potato,medica,limonum,mandarin,pond's,description,walnut,filtrate,ceramide,granatum,vulgare,rapeseed,butyloctyl,octyldodecyl,sunscreen,carboxylate,eugenia,globulus,basil,distilled,arachidyl,liquid,toner,flour,trideceth,brassica,chondrus,crispus,oleracea,borago,light,blue,hydrated,smdi,parsley,thyme,forest,essentials,earth,ursi,alanine,peroxide,oleic,linoleic,alternifolia,glycyrrhetinic,spirulina,anthemis,peg-32,flaxseed,carnauba,night,shaklee,isostearyl,cananga,odorata,alchemilla,grapeseed,saccharin,peg-18,dimethyl,silane,color,phrase,property,palmate,kernelate,biotin,sephora,conditioner,sesquistearate,idaeus,strawberry,phenylbenzimidazole,sulfonic,inactive,behenate,patchouli,caryophyllus,ternifolia,buckthorn,nylon,isopropylparaben,polymethyl,silsesquioxane,stars,tamanu,vicco,arvensis,silk,propolis,distearyldimonium,althaea,propionate,lightweight,sulfite,polydimethylsiloxyethyl,cera,acrylamide,clinique,matte,trihydroxystearin,diglyceryl,polyacyladipate,polyhydroxystearic,balm,methoxy,cinnamate,maltodextrin,lactobacillus,arctostaphylos,isobutane,isoparaffin,peptides,benzoyl,esters,poloxamer,benefits,balance,properties,hydration,gluconate,mipa,ethanol,mannitol,paint,hibiscus,pentapeptide,citral,pepper,coriander,hydroxycitronellal,multani,mitti,henna,brahmi,clear,cocoamphodipropionate,peg-14m,himalaya,herbals,polydecene,cerifera,glucosamine,gluconolactone,company,caffeine,symphytum,achillea,laminaria,fenugreek,oleifera,sandalwood,khadi,jasmine,johnson's,baby,cetostearyl,stearamidopropyl,dimethylamine,quince,syrup,kernels,lysate,shai,maybelline,colossal,mascara,oleyl,peg-75,myreth,polyglycerin,camu,olefin,yeast,carica,ecocert,raspberry,vaccinium,macrocarpon,cranberry,blackberry,plus,cocoamidopropyl,sulfoacetate,earplugs,used,ginger,emulsifier,pack,holy,castile,visage,campestris,borax,portulaca,active,gold,parabens,botanical,foundation,pyrophosphate,stay,estee,lauder,makeup,ferric,ferrocyanide,chromium,greens,violet,lake,fluorphlogopite,diluent,geranium,primrose,carrageenan,triclosan,lily,artemisia,absinthium,cymbopogon,martini,gluten,ultra,include,jelly,pumpkin,chlorhexidine,includes,butane,tangerina,linseed,pine,bergamot,resveratrol,vlcc,leaves,deep,pure,echinacea,complex,peg-55,acidum,lacticum,cysteine,myristic,malate,corporation,household,mint,ethylhexanoate,concinna,millefolium,hamamelis,virginiana,planifolia,curcuma,longa,paradisi,santalum,album,mamaearth,tangerine,tridecyl,spearmint,fuller's,colloidal,oudh,saffron,rosehip,malus,type,brand,silicon,soja,xylenesulfonate,tocopherols,aveeno,panax,kojic,canina,foeniculum,brown,serine,valine,threonine,proline,phenylalanine,histidine,mogra,rich,succinate,bees,shell,sandal,trioctyldodecyl,unsaponifiables,polyricinoleate,paraffin,triethylhexanoin,microcrystalline,fluid,methylpropanediol,leuconostoc,fomes,mushroom,extrait,centella,asiatica,poly,tamarind,rhubarb,derived,chamaemorus,arctic,cloudberry,malva,sylvestris,mallow,triticum,sprout,bixa,orellana,annatto,eicosadioate,stearatis,formula,help,reduce,piroctone,olamine,diheptanoate,polysilicon,hydroxyapatite,handwash,pollen,methanol,plantain,sesamum,indicum,nigella,capsicum,annuum,decylaldehyde,phenethyl,phythoxyethanol,gram,succinic,betel,sulphosuccinate,nuts,cyprolactin,essence,octylcrylene,parsol,diethyltoluenediamine,helioplex,garnier,chemical,australian,botanics,althea,lonicera,japonica,honeysuckle,olivoyl,pigments,aromas,trimethylsiloxy,dimethacrylate,mousse,broad,spectrum,diphenyl,adipic,disilicate,carmine,bismuth,oxychloride,ultramarines,dipentaerythrityl,sononanoin,polybutylene,burdock,yarrow,cinnamomum,cassia,octylacrylamide,morus,scutellaria,baicalensis,paeonia,suffruticosa,chrysanthemum,morifolium,thymol,soda,paraben,lilybaeum,japonicum,ethoxydiglycol,inci,hydroxyethanol,tetracaprylin,palmarosa,superfine,silicone,sulfates,rhododendron,ferrugineum,alcohols,besan,nourish,mild,moisturizes,maintains,peg-2,oleamine,cocodimonium,vaseline,hexylresorcinol,wash,ethyl,nasal,spray,alcoholic,wine,cane,pigment,varnish,girl,ease,peanut,needles,moroccan,lava,french,maize,herbal,hydroxymethylglycinate,khanda,bala,aralia,keertikka,pippali,kakroli,dalchini,moti,elaichi,kesar,kasturi,lawsonia,inermis,lavangal,lavangatmaka,lavangkashaya,lavangurdhi,lavangvisharadi,pelargonium,graveolens,buteth,free,gently,cleanse,hydrate,frizzy,methoxyethyl,make,aroma,hydrolized,cider,bulgarian,peg-50,kawa,tetrastearate,peg-200,octapeptide,tetradecene,polystyrene,sostearyl,almay,complexion,methicillin,copernicia,betula,birch,monoethanolamine,tetraisopalmitate,aminomethyl,propanol,hydroxypropylmethylcellulose,cinnamic,aldehyde,seaweed,around,world,nutritional,personal,stanley,first,guduchi,gluceth,carboxymethyl,dibasic,ives,bisopropyl,butoxyethanol,boswellia,serrata,salix,zingiber,adhatoda,vasica,thymus,reticulata,purity,garlic,almonds,hemp,trimellitate,virgin,haldi,ground,lettuce,ponds,towelettes,cold,conditioners,sakura,mixture,guava,surge,lauriminodipropionate,phosphates,arjun,himalayan,fish,coral,plant,illipe,your,anti,gingili,witch,hazel,domestica,cell,culture,phospholipids,tetrahydrozoline,digluconate,babies,babassu,euterpe,hypericum,perforatum,jacquemontia,pudica,quartz,letter,sensitive,passionflower,euphorbia,coffea,arabica,kelp,tricholoroethyl,methlyparaben,bisphenol,diglycidyl,stearalkonium,clarity,thiolactate,dodecane,fd&c,molasses,gardenia,pantenol,ubiquinone,carum,petroselinum,purpose,centifolia,cosmetic,ginko,biloba,polyacryloyldimethyl,extracts,pear,arctium,lappa,menthyl,skim,hydroxysultaine,metaphosphate,avena,sles,fluoride,cornflower,glutamine,aspartic,methionine,phospholipon,salts,trehalose,benzenesulfonate,dipeptide,diaminobutyroyl,benzylamide,diacetate,less,than,gluconoactone,polyacrylic,coenzyme,kohl,lipcolor,carnitine,pumice,zeolite,clary,hops,elderberry,mighty,immune,flavors,nuojua,purpurea,royal,saccharina,pterygosperma,schizyphus,jujuba,mume,finish,triple,power,stays,true,easy,remove,demethicone,oleamido,rosinate,triglycerides,distearyl,borosilicate,mountain,pa++,borage,l'oreal,daywear,advanced,radiance,squalene,methylglucose,dextrin,sostearoyl,oenothera,biennis,polymethacrylate,etidronate,amide,arachidonic,peg-5,povidone,radish,ectoin,amylcinnamaldehyde,kiwi,malic,kama,succinylated,whip,amino,acids,pyrithione,food,linolenic,elderflower,xylinum,racine,d'aconit,tripeptide,echium,plantagineum,tartaric,levulinate,isopentyldiol,tetra,hydroxyhydrocinnamate,triethoxycaprylyl,pantothenate,neopentanoate,ethylenediamine,disuccinate,carotene,napus,canola,phytate,rhubarbaras,rhizome,sorbet,mirabella,biosilk,davines,treatment,xanthum,limonium,lavendula,retinoate,avon,protect,acrylamidopropyltrimonium,ipdi,heard,aids,often,people,tinnitus,loss,block,noise,environment,elaeis,guineensis,persica,peach,biodegradable,isobutyl,isotearyl,wood,aluminium,cinnamidopropyltrimonium,cinnamidopropyl,trimonium,whole,isostearoyl,artificial,acqua,acylates,acetates,oligosaccharide,fructooligosaccharides,sterols,arabic,turpentine,boric,squeeze,refined,known,percent,protectivity,boat,sport,performance,peg-30,dipolyhydroxystearate,fabricant,aspartate,phthalates,fragrances,petrochemicals,ester,infallible,glow,cire,abeille,persulfate,oleth,butyleneglycol,double,wear,place,polysilicase,manganese,polysilase,nettle,comfrey,baobab,horsetail,larch,blossom,balanced,recommended,avoid,pregnant,breast,lemongrass,poppyseed,certified,topical,jovees,defense,cosmetics,ethylenediaminetetraacetic,hexane,element,material,carbopol,riboflavin,methylluanetriol,capryl,straw,glycosides,lauatriol,lancôme,teint,idole,wearables,concealer,ptfe,elastomer,what,moisturizer?,maintain,healthy,levels,provide,provides,petroleum,avacado,cacamide,hydrochloric,trometamol,potasssium,oats,olives,eczema,noni,hips,anionic,cationic,polymers,peanuts,mandelic,marigold,caviar,bicarbonate,roots,gylcol,alcoholmethylparaben,inorganic,grass,does,contain,considered,dangerous,ewg's,database,weight,scent,refine,saundarya,sclerotium,marshmallow,self,heal,designed,exfoliate,pore,irritant,cocamidopropylamine,hydrogen,undeceth,nioxin,extractaloe,john,frieda,frizz,kamalaya,lauramide,lush,fresh,ethylpar,olay,prox,rowspan=2,wate,l'eau,l’eau,privately,owned,multinational,headquartered,pleasanton,california,offices,makes,distributes,supplement,cleaners,established,shaklee's,multivitamin,introduced,public,since,expanded,offer,variety,supplements,glycerol,ceratonia,siliqua,distarch,myristica,fragrans,caprate,l'occitane,isoceteth,lakme,camphor,armillaris,fraterna,cladosiphon,okamuranus,ficus,benjamina,bergenia,cordifolia,juglans,regia,digitata,salvia,nepeta,cataria,ocimum,basilicum,tilia,cordata,vetiveria,zizanoides,leucadendron,cajaputi,caryophyllata,jasminum,shucked,spinoza,undecylenoyl,cedrus,atlantica,sorbito,jamaican,extra,absolute,camille,naturals,tallowate,broom,citrata,shells,dahi,badam,khandai,chaulmoogra,arrowroot,more,shop,indian,produce,jaitun,mulberry,sharifa,sowparnika,punarnava,tejasvi,tapioca,jade,order,over,will,texture,blend,powerful,oxidants,perfect,addition,regime,fractionated,lumizyme,lanoline,tissues,sold,created,sells,largest,health,made,nitrate,four,tepezcohuite,coppe,sapindus,mukorossi,amyl,eugenol,isoeugenol,hydroxycitronellol,waener,shahnaz,husain,delight,currant,serenoa,serrulata,hazelnut,last,post,shave,equisetum,arvense,robertianum,juniperus,spiraea,ulmaria,watercress,willow,millefol,hide,linum,usitatissimum,flax,ochroleuca,condition,style,volume,gingelly,preservative,cherry,wipes,diphenylsiloxy,ingredient's,function,medicinal,serum,hydroxyethoxycinnamate,unrefined,spices,cost,manufactured,delicate,feminine,soft,smooth,form,website,madurai,glycosyl,organix,recovvery,from,washed,bee's,fatty,keratin,seabuckthorn,glyceride,undecyl,melia,azadirachta,–aqua,ethylhexyglycerin,model,lakshmi,revathi,benefit,urban,decay,waxes,silicones,butylated,hydroxytoluene,possible,coffee,common,evoo,ethylhexylgylcerin,carrots,seawater,alkalized,foreo,clearer,full,concentration,each,rooibos,simmondia,dead,soapia,olus,trimethoxycaprylylsilane,superstay,phenylpropanol,shot,water\aqua\eau,composition,ceresin,sosteeryl,triethanolhexanone,microcristallina,asafoetida,jaiphal,externalcatid,unique,identifier,herbs,child,massage,producttype,ointment,labelingclaims,purchased,amazon,remineralized,zealand,marine,perfection,flavor,descriptor,meta,size,quercetin,bisabolo,lactose,cetaphil,aesculus,hippocastanum,horse,chestnut,hydroquinone,shiseido,lucent,wrinkle,emulsion,soya,repair,when,nightly,offers,intense,helps,appearance,fine,lines,wrinkles,eyes,ascorborate,clean,cleans,into,pores,relief,medical,other,origins,isodecanoate,mays,isoleucine,theanine,fructose,maltose,solanum,lycopersicum,tomato,pyrus,tromethamine,hedera,helix,fillers,proprietary,microcapsules,https,pinterest
Biotique Bio Purifying Facial Scrub,1 extract seed fruit olive juice lemon rosemary grape eucalyptus lime salt
Biotique Bio Face Soap,1 sodium extract water glycerin fragrance aloe leaf butter acetate tocopheryl panthenol shea aqua barbadensis fruit juice allantoin butyrospermum park palm benzophenone papaya cucumis sativus palmate kernelate biotin carica
Biotique Bio Tearless Baby Facial Wash,1 extract aloe coconut vera honey tamarind
Biotique Bio Strawberry Rhubarb Soap,1 sodium extract glycerin fragrance butter potassium betaine aqua cocamidopropyl sorbate titanium dioxide citrus butyrospermum park dulcis aurantium coco sulphate rhubarb rhubarbaras rhizome sorbet
Biotique Bio Purifying Face Mask,1 juice peel orange turmeric lime
Biotique Bio Sunblock Lotion SPF25,1 alcohol water glycerin glycol dimethicone edta disodium stearate propylene cetyl benzoate copolymer ethylhexyl acrylates methoxycinnamate triethanolamine hexyl butyl methoxydibenzoylmethane dmdm hydantoin biotique benzophenone hydroxybenzoyl diethylamino hair shampoo mask perfume care sucrose body sephora conditioner mirabella biosilk davines treatment
Biotique Bio Facial Scrub,1 sodium extract alcohol water dimethicone stearate aloe sulfate butter chloride polysorbate cetyl potassium seed copolymer hydroxide shea vera fruit olive lauryl iron butyrospermum park distearate oxides lauroyl mica oleate peg-8 palm grapefruit cucumber olea europaea cocoate vinyl green octyldodecanol lactylate glycerides kernelate xanthum
Biotique Bio Gentle Facial Wash,1 sodium extract water acid phenoxyethanol sulfate glyceryl laureth potassium citric betaine sorbate organic lauryl citrus flower methyl dulcis rose aurantium glucose coco cocoate lavandula angustifolia peg-7 peg-20 sesquistearate ecocert
Biotique Bio Strawberry Rhubarb Soap,1 sodium extract water glycerin acid fragrance edta disodium chloride potassium seed benzoate citric aqua fruit sorbate citrus almond wheat lemon orange dulcis aurantium prunus sweet cocoate vegetable hydroxypropyl algae cetrimonium methylcellulose liquidum limon amygdalus simethicone pomegranate rubus punica granatum vulgare palmate idaeus raspberry vaccinium macrocarpon cranberry blackberry derived chamaemorus arctic cloudberry malva sylvestris mallow triticum sprout bixa orellana annatto
Biotique Bio shampoo,1 lavender lemon officinalis limonium lavendula
Biotique Bio Tearless Baby Facial Wash,1 sodium water glycerin glycol acid disodium phenoxyethanol propylene betaine hydroxide cocamidopropyl cocoyl glucoside coco salicylic glutamate cocoamphoacetate
Biotique Bio Strawberry Rhubarb Soap,1 sodium alcohol water glycerin acid edta disodium phenoxyethanol stearate cetearyl methylparaben glyceryl cetyl potassium benzoate coconut hydroxide benzyl stearic linalool sunflower limonene palm biotique vegetable soap rapeseed strawberry rhubarb
Avon Basics Sunstoppers Sunscreen SPF 50,1 alcohol water glycerin dimethicone phenoxyethanol stearate methylparaben cetyl benzoate ethylhexyl crosspolymer peg-100 butylparaben alkyl stearyl isobutylparaben salicylate benzophenone avobenzone butyloctyl octyldodecyl retinoate avon
Nivea Sun Protect Plus Sunscreen Lotion SPF 50,1 alcohol water glycerin glycol edta disodium stearate cetearyl methylparaben glyceryl polysorbate palmitate ethylhexyl peg-100 carbomer methoxycinnamate triethanolamine pentylene octocrylene nivea lotion sunscreen plus protect
Kiehls Facial Fuel UV Sunscreen SPF 50,1 sodium alcohol water glycerin glycol acid dimethicone fragrance edta disodium phenoxyethanol stearate acetate cetyl potassium tocopheryl benzoate copolymer palmitate hydroxide aqua sorbate acrylate benzyl peg-100 xanthan silica hyaluronate allantoin beeswax ethylhexylglycerin ascorbyl taurate stearyl ceteareth aluminum retinyl acryloyldimethyl salicylate ascorbic pentylene octinoxate behenyl avobenzone octisalate oxybenzone homosalate trisiloxane tetrahexyldecyl ascorbate butyloctyl
Blue Lizard Australian Sunscreen SPF 30+,1 extract water glycerin acid aloe leaf benzoate copolymer ethylhexyl barbadensis acrylates methoxycinnamate hexyl dicaprylyl carbonate butyl methoxydibenzoylmethane hydroxybenzoyl diethylamino octyl polyester methoxycrylene phenylbenzimidazole sulfonic
Coppertone Kids Sunscreen Stick SPF 30,1 alcohol dimethicone fragrance edta disodium phenoxyethanol stearate glyceryl acetate tocopheryl copolymer palmitate crosspolymer acrylates peg-100 beeswax ethylhexylglycerin caprylic capric peg-10 retinyl denat triglyceride octocrylene avobenzone octisalate oxybenzone homosalate inactive behenate eicosadioate stearatis
Banana Boat SunComfort SPF 30,1 water ethylhexyl salicylate avobenzone octisalate homosalate
Forest Essentials Lavender & Clove Hair Cleanser,1 sodium water glycerin fragrance disodium sulfate chloride polysorbate laureth copolymer panthenol betaine aqua cocamidopropyl lauryl lavender cocoyl glucoside isethionate glucose cocamide coco lavandula angustifolia quaternium clove cocoamphodiacetate pogostemon cablin carboxylate eugenia patchouli caryophyllus cocoamidopropyl formula acrylamidopropyltrimonium ipdi
Forest Essentials Aloe & Chamomile Hair Cleanser,1 sodium extract water aloe vera lauryl chamomile sulfoacetate
Forest Essentials Chamomile & Rosehip Hair Cleanser,1 sodium extract alcohol water glycerin glycol cetearyl leaf sulfate propylene flower polyquaternium rose olea europaea rosa chamomilla recutita matricaria damascena with earplugs used help reduce heard aids often people tinnitus loss block noise environment
Forest Essentials Coconut & Peach Hair Cleanser,1 sodium extract alcohol phenoxyethanol stearate glyceryl butter cetyl seed palmitate panthenol coconut fruit olive peg-100 sorbitol ethylhexylglycerin cocoyl kernel isethionate steareth palm prunus olea europaea cocoa cocos nucifera macadamia theobroma cacao ternifolia elaeis guineensis persica peach
Forest Essentials Orange & Ginger Hair Cleanser,1 sodium water glycerin sulfate laureth benzoate betaine fruit olive cocamidopropyl lauryl peel orange citrate root buckthorn ginger
Forest Essentials Wild Berry & Hibiscus Hair Cleanser,1 sodium alcohol water glycerin fragrance phenoxyethanol sulfate laureth cetyl betaine cocamidopropyl titanium dioxide methylisothiazolinone methylchloroisothiazolinone piroctone olamine
Forest Essentials Koroneiki Olive Oil & Lavender Hair Cleanser,1 sodium water glycerin glycol acid fragrance sulfate glyceryl chloride laureth panthenol betaine cocamidopropyl polyquaternium limonene cocoate peg-7 hexylene olivate lauric
Forest Essentials Olive & Honey Hair Cleanser,1 aloe vera olive honey
Forest Essentials Olive & Rosemary Hair Cleanser,1 extract water glycerin leaf coconut olive kernel rosemary palm soybean emulsifier biodegradable
Lakmé Absolute Skin Natural Mousse Foundation,1 alcohol water glycerin dimethicone phenoxyethanol stearate methylparaben glyceryl polysorbate cetyl copolymer crosspolymer hydroxide acrylates acrylate butylparaben alkyl ethylparaben triethanolamine stearyl aluminum isobutylparaben peg-12 adipate nylon isopropylparaben isobutyl
Lakmé Skin Natural Mousse Foundation,1 extract alcohol water glycerin glycol dimethicone edta disodium phenoxyethanol aloe cetearyl methylparaben propylene propylparaben palmitate ethylhexyl vera aqua fruit olive cyclopentasiloxane carbomer silica olea europaea isononanoate isononyl neopentyl diheptanoate
Lakmé Wonder Glow Flawless Radiance Mousse Foundation,1 sodium extract alcohol water glycerin glycol acid dimethicone fragrance phenoxyethanol stearate aloe methylparaben sulfate glyceryl butter propylene acetate laureth tocopheryl panthenol crosspolymer shea barbadensis fruit acrylates acrylate cyclopentasiloxane peg-100 stearic hyaluronate flower alkyl butyrospermum park denat cucumis sativus polyacrylamide dicaprylate dicaprate isotearyl wood
Lakmé Skin Perfecting Mousse Foundation,1 water glycerin dimethicone fragrance phenoxyethanol stearate glyceryl acetate laureth tocopheryl benzoate palmitate ethylhexyl aqua carbomer silica alkyl mineral ether isopropyl dicaprylyl polyacrylate myristate alumina liquidum paraffinum aluminium
Lakmé Skin Natural Matte Mousse Foundation,1 sodium water glycol dimethicone phenoxyethanol stearate methylparaben leaf propylene chloride acetate butylene tocopheryl copolymer propylparaben palmitate ethylhexyl crosspolymer acrylates acrylate cyclopentasiloxane titanium dioxide sorbitan silica iron lavender alkyl ethylhexylglycerin ascorbyl oxide myristate benzophenone lavandula angustifolia bisabolol myristyl citronellol methicone methacrylate cinnamal polyethylene geraniol eucalyptus isostearate stearoyl peg-20 methoxycrylene octyldodecyl globulus polymethyl cinnamidopropyltrimonium cinnamidopropyl trimonium
Lakmé Skin Perfecting Oil Free Mousse Foundation,1 sodium alcohol water glycerin dimethicone edta disodium stearate methylparaben glyceryl chloride cetyl copolymer propylparaben crosspolymer cyclopentasiloxane peg-100 butylparaben ethylparaben citrate phosphate aluminum peg-10 isobutylparaben magnesium polyglyceryl vinyl phenyl trimethicone silicate methicone cyclohexasiloxane isostearate silsesquioxane polysilicon hydroxyapatite
Patanjali Aloe vera,1 water aloe coconut vera almond turmeric patanjali powder rice hair face shampoo pack handwash
Patanjali Bee Pollen,1 patanjali seeds fennel pollen
Patanjali Aloe vera lotion,1 sodium glycerin acid edta disodium phenoxyethanol aloe leaf laureth potassium citric vera aqua barbadensis sorbate carbomer juice tetrasodium sulphate lotion methanol
Patanjali Aloe vera extract,1 extract aloe leaf vera juice patanjali powder mentha chamomile piperita basil holy plantain whole
Patanjali Aloe vera moisturizing cream,1 sodium alcohol water glycerin glycol acid fragrance phenoxyethanol aloe propylene cetyl palmitate hydroxide barbadensis carbomer stearic ethylhexylglycerin triethanolamine stearyl lecithin lactylate distilled arachidyl stars isostearoyl
Patanjali Aloe vera gel,1 sodium water glycerin glycol edta disodium phenoxyethanol aloe propylene potassium benzoate barbadensis sorbate citrus dulcis aurantium sativa sesamum indicum nigella capsicum annuum
Patanjali Aloe vera juice for hair,1 sodium water glycerin fragrance aloe laureth panthenol vera carbomer juice triethanolamine sulphate artificial
Patanjali Aloe vera soap,1 sodium extract water aloe butter seed coconut hydroxide shea vera olive vitamin kernel grapefruit apricot soap glycerine saponified liquid castile
Patanjali Aloe Vera face mask,1 alcohol glycerin aloe cetearyl vera honey cream
